{
  "specversion": "1.0",
  "id": "01JABCDEVT00000000000000006",
  "source": "/osf/forge",
  "type": "pr.opened@v1",
  "time": "2026-10-19T09:05:00Z",
  "subject": "https://github.com/acme/web/pull/7",
  "datacontenttype": "application/json",
  "data": {
    "url": "https://github.com/acme/web/pull/7",
    "repository": "https://github.com/acme/web",
    "number": 7,
    "title": "Fix checkout button on Safari",
    "headBranch": "factory/01JABCDWORK0000000000000001",
    "baseBranch": "main",
    "headCommit": "9b1c2d3e4f5a6b7c8d9e0f1a2b3c4d5e6f7a8b9c",
    "author": {
      "kind": "trigger",
      "id": "osf:foreman"
    },
    "workItemId": "01JABCDWORK0000000000000001",
    "runId": "01JABCDRUN00000000000000001"
  }
}
